{
  "type": "amc.control-result",
  "version": 1,
  "controlId": "AC-7",
  "controlVersion": "1.0.0",
  "evaluatedAt": "2026-01-01T00:00:00.000Z",
  "dimensions": {
    "result": "not_evaluated",
    "applicability": {
      "state": "unresolved",
      "reason": "no deployment profile"
    },
    "evidence": "incomplete",
    "enforcement": {
      "state": "none"
    },
    "review": "pending"
  },
  "claimKind": "self_reported",
  "evidenceRefs": [],
  "exceptions": [],
  "entitlement": {
    "active": false
  }
}
